arg-id,comment-id,argument
A1_0,1,Tokyo
A2_0,2,Sushi
A3_0,3,AI technologies should be developed with a focus on reducing their own environmental impact over their lifecycle.
A3_1,3,"There should be a concerted effort to educate the public about the capabilities, limitations, and ethical considerations of AI."
A3_2,3,AI can optimize smart homes and buildings for energy efficiency and occupant wellbeing.
A3_3,3,"AI can help optimize energy grids, reducing waste and carbon emissions."
A4_0,4,Japanese cherry trees bloom beautifully in the spring.
A5_0,5,Ramen.
A6_0,6,The term 'Samurai' does not relate to the topic of artificial intelligence.
A7_0,7,"Anime is a popular form of entertainment that combines art, storytelling, and culture."
A8_0,8,AI can optimize energy grids to reduce waste and carbon emissions.
A10_0,10,"Nintendo was mentioned, but no specific argument was provided."
A11_0,11,This input does not seem relevant to the topic of artificial intelligence.
A12_0,12,This input does not appear to be related to the topic of artificial intelligence.
A14_0,14,"AI can help optimize energy grids, reducing waste and carbon emissions."
A15_0,15,Impeccable woodworking.
A16_0,16,This input is not relevant to the topic of artificial intelligence.
A17_0,17,Hiroshima is a city in Japan known for its historical significance.
A18_0,18,The song 'I'm Turning Japanese' by the Vapors.
A19_0,19,Japow refers to Japan's powder skiing and riding.
A20_0,20,"Japan exemplifies social responsibility, with citizens taking pride in their country, jobs, and community, and consistently abiding by social rules."
A21_0,21,Hot spas
A21_1,21,Anime
A21_2,21,Ramen
A21_3,21,War crime denial
A22_0,22,"Japanese craftsmanship is meticulous, with a high level of skill and pride in their work."
A22_1,22,Japanese-made cameras and musical instruments are stunning examples of this craftsmanship.
A23_0,23,Shohei Ohtani is a professional baseball player.
A25_0,25,Mount Fuji is not relevant to the topic of artificial intelligence.
A26_0,26,"AI can help optimize energy grids, reducing waste and carbon emissions."
A27_0,27,Karate
A29_0,29,"People usually don't litter and take their trash home, which is commendable."
A30_0,30,AI can enhance technology and contribute to a cleaner country.
A30_1,30,AI can improve animation techniques.
A30_2,30,AI can optimize sushi production.
A30_3,30,AI can assist in managing seniority in the workplace.
A32_0,32,Pikachu is not relevant to the discussion on artificial intelligence.
A33_0,33,AI can contribute to the development of awesome and reliable cars.
A35_0,35,This statement is not relevant to the topic of artificial intelligence.
A36_0,36,Tentacles
A37_0,37,"Samurai were Japanese warriors known for their martial skills, honor, and loyalty."
A38_0,38,There is a trend of neon signage and cute anime characters.
A38_1,38,Young ladies are dressing up in unique fashions.
A39_0,39,Japan has beautiful natural scenery that I would like to visit someday.
A40_0,40,There are concerns about the portrayal of perversion in anime.
A41_0,41,Manga and anime
A42_0,42,AI should be used to document and analyze historical events like WW2 war crimes.
A43_0,43,New Japan Pro Wrestling
A45_0,45,AI should be used to monitor and prevent suicides in high-risk areas like forests.
A47_0,47,The Yamato.
A48_0,48,Hiroshima
A49_0,49,The people in Osaka and Kobe are very polite.
A49_1,49,Osaka and Kobe are clean and tidy cities.
A49_2,49,Visit Osaka and Kobe if you have the chance.
A52_0,52,"I remember searching for a special ramen restaurant with my girlfriend (now wife) for hours without fancy phones, using maps and asking for directions."
A52_1,52,"We were stressed out when we finally found the restaurant and got in line, but a waiter handed us an English menu, which made us laugh and enjoy the experience. The ramen was great!"
A53_0,53,This input does not seem to be related to the topic of artificial intelligence.
A54_0,54,No argument provided.
A55_0,55,AI should be used to protect marine life and prevent activities that harm sea creatures.
A56_0,56,Important nuances and cultural contexts can be lost when AI translates languages.
A57_0,57,"AI can help optimize energy grids, reducing waste and carbon emissions."
A58_0,58,AI should be regulated to prevent its use in committing war crimes.
A59_0,59,"Crimes against humanity that they refuse to acknowledge, even to this day."
A60_0,60,Tentacles
A61_0,61,Tentacles
A62_0,62,Tentacles
A63_0,63,I want to understand their culture to see how much we are alike and what makes us different.
A64_0,64,I want to go there.
A65_0,65,"In Osaka, an old man asked to practice his English with me, and we talked about local attractions for half an hour. At the end, he thanked me, and I thanked him in Japanese. He smiled and said, 'You need practice!' It was the hardest I laughed during my entire four-week trip."
A67_0,67,Ninjas
A68_0,68,AI can help create tidy and low-crime environments.
A68_1,68,AI can contribute to repressed societies.
A68_2,68,AI can be used to create the weirdest game shows ever.
A69_0,69,Tentacles
A70_0,70,"AI can help optimize energy grids, reducing waste and carbon emissions."
A71_0,71,Ramen is delicious.
A72_0,72,Sushi
A73_0,73,Honda/Acura
A74_0,74,No relevant argument provided.
A75_0,75,This is not relevant to the topic of artificial intelligence.
A78_0,78,Mikasa Ackerman is a character from the anime and manga series 'Attack on Titan.'
A79_0,79,AI could help alleviate the workload of exhausted office workers.
A80_0,80,The Rape of Nanjing was a horrific event during which Japanese forces committed atrocities against Chinese civilians and soldiers in 1937.
A81_0,81,We had amazing experiences visiting.
A82_0,82,AI development should be guided by strict ethical standards and regulations.
A83_0,83,The Rape of Nanking is a historical event that more people should be aware of due to its significance and impact.
A84_0,84,AI should be regulated to prevent its use in committing war crimes.
A85_0,85,Fish
A86_0,86,"People should refer to each other by their surnames with honorifics like -san, -chan, and -kun."
A87_0,87,Mosaic Blur
A89_0,89,AI can help preserve beautiful temples and historic architecture.
A90_0,90,No argument provided.
A91_0,91,AI should be developed and used for peaceful purposes.
A92_0,92,AI should be designed to interact in a friendly and approachable manner.
A93_0,93,Attack on Titan?
A93_1,93,Anime in general
A93_2,93,Even unnecessarily censored 'Porn'
A94_0,94,Westerners are overly obsessed with AI.
A96_0,96,My Polish sister-in-law is obsessed with Japan.
A98_0,98,No relevant argument provided.
A99_0,99,We need to address the potential for AI to perpetuate or exacerbate racism.
A99_1,99,AI innovation should include measures to prevent racial bias.
A100_0,100,The Imperial Japanese committed numerous atrocities during their reign.
A102_0,102,AI can optimize energy grids to reduce waste and carbon emissions.
A103_0,103,Fancy toilet
A104_0,104,Yoko.
A105_0,105,"AI can help optimize energy grids, reducing waste and carbon emissions."
A106_0,106,AI can be used to improve vehicle performance and safety.
A107_0,107,This input does not appear to be related to the topic of artificial intelligence.
A108_0,108,Skiing in powder snow offers a unique and enjoyable experience.
A109_0,109,A castle in Kyoto is a notable landmark.
A109_1,109,Yokohama is a city I would love to visit someday.
A111_0,111,"Hayao Miyazaki, from Studio Ghibli, is a notable figure in animation."
A112_0,112,This input does not appear to be related to the topic of artificial intelligence.
A113_0,113,Powerful AI systems should be regulated to prevent misuse and ensure safety.
A114_0,114,"A crowded, large city"
A115_0,115,Indian food offers a diverse range of flavors and dishes.
A115_1,115,Convenience store fried chicken is a quick and accessible meal option.
A116_0,116,The sun flag is associated with war crimes.
A116_1,116,Anime is a popular form of entertainment.
A117_0,117,"AI can help optimize energy grids, reducing waste and carbon emissions."
A118_0,118,There is concern that some actions taken during WWII went unpunished.
A119_0,119,Custom Maid 3D is a topic related to AI in entertainment and gaming.
A120_0,120,AI can be misused for unethical purposes.
A122_0,122,I lived in my second home for almost a decade.
A122_1,122,I visit my husband's family there every other year.
A123_0,123,There is a concern about nationalistic racism in AI development.
A124_0,124,AI should be regulated to prevent its use in committing war crimes.
A125_0,125,AI could be used to identify and support suicidal youth.
A126_0,126,This input does not appear to be an argument related to artificial intelligence.
A127_0,127,AI can improve the functionality and efficiency of vending machines.
A128_0,128,"Some establishments have discriminatory policies, such as signs that say 'No Westerners Allowed.'"
A129_0,129,"Sex crimes such as sexual molestation, kidnapping, and raping are serious issues."
A129_1,129,Toyota appears attractive but has many natural disasters and poor treatment of lower-ranking or younger individuals.
A129_2,129,"Despite these issues, the culture in Toyota is interesting in some ways."
A130_0,130,AI should be regulated to prevent its use in committing war crimes.
A131_0,131,There is a lack of acknowledgment of war crimes committed in South Asia and the South Pacific.
A131_1,131,"Japan's marketing strategy, portraying a 'kawaii' image, is highly effective."
A132_0,132,"I found it amusing when my friend mentioned they have Japanese ancestry, and I almost made a joke about 'Japan-genes.'"
A133_0,133,The age of consent for AI interactions should be carefully considered.
A134_0,134,Inappropriate or offensive language should not be used in public consultations.
A135_0,135,A 12-sided eraser has been on my mind since I saw a video promoting it.
A136_0,136,"A memorable meal in Fukuoka, Japan, has made me think of it every time Japan is mentioned."
A137_0,137,Karai is a character from Teenage Mutant Ninja Turtles (TMNT).
A138_0,138,"I would love to visit and spend time in Japan, as it is very different from living in the Midwest US."
A138_1,138,"Japan faces significant risks from natural disasters, such as major earthquakes, which could lead to financial and humanitarian crises."
A138_2,138,The potential for a major earthquake in Tokyo could result in trillions of dollars in damage and severe consequences for Japan's economy and nuclear facilities.
A139_0,139,AI can optimize train systems for efficiency and safety.
A141_0,141,Rapid industrialization and modernization enabled Japan to become a major imperial power in Asia within five decades after Commodore Perry opened the nation in 1853.
A142_0,142,Fukushima is causing ocean pollution.
A143_0,143,There are many Japanese people involved.
A144_0,144,This input does not appear to be related to the topic of artificial intelligence.
A145_0,145,It's an interesting place to visit and live.
A145_1,145,The vending machines are notable.
A146_0,146,Japan should invest in AI technologies to stay competitive globally.
A148_0,148,"I spent 11 nights drinking and singing karaoke with strangers in The Golden Gai, Shinjuku, Tokyo."
A149_0,149,High-quality sushi is important.
A150_0,150,Mt. Fuji
A152_0,152,Japan has the fastest declining birthrate in the world.
A152_1,152,Anime is enjoyable despite some negative opinions.
A154_0,154,AI can optimize energy grids to reduce waste and carbon emissions.
A155_0,155,I enjoy the taste of raw fish and soy sauce.
A156_0,156,Ramen.
A157_0,157,AI can help optimize food production and distribution.
A158_0,158,Crosswalks should be designed to ensure the safety of pedestrians.
A159_0,159,AI can improve cleanliness in various environments.
A160_0,160,Hank Hill has a Japanese half-brother.
A161_0,161,They enhanced their reputation by incorporating cute elements and pop culture.
A162_0,162,Japan is a country I admire and hope to visit one day.
A163_0,163,Gundams
A164_0,164,The word 'Japan' in big red font with cherry blossoms falling.
A165_0,165,This argument is not relevant to the topic of artificial intelligence.
A166_0,166,AI can help maintain cleanliness and order.
A167_0,167,AI should promote cleanliness and courtesy.
A168_0,168,Heavy snowfall in Vermont is often compared to the snowfall in Japan.
A169_0,169,Kamikaze pilots were ruthless in their actions during their time.
A170_0,170,"AI can help optimize energy grids, reducing waste and carbon emissions."
A171_0,171,"A beautiful country with lots of history, amazing art, and nice people."
A172_0,172,Tokyo metro station loudspeakers end announcements with 'arigato gozaimasu'.
A173_0,173,Cherry blossom trees enhance the aesthetic appeal of environments.
A173_1,173,Efficiency improvements are crucial for technological advancements.
A174_0,174,I was laid off when I worked there.
A175_0,175,Cherry blossoms are beautiful and culturally significant.
A176_0,176,This input does not appear to be an argument related to AI.
A179_0,179,"There should be a concerted effort to educate the public about the capabilities, limitations, and ethical considerations of AI."
A180_0,180,AI should be used to prevent the proliferation and use of nuclear weapons.
A182_0,182,This input is not relevant to the topic of artificial intelligence.
A183_0,183,AI could help address high suicide rates.
A183_1,183,AI could improve work ethics.
A183_2,183,AI could help address low birth rates.
A184_0,184,"AI can help bring together various special interests like Nintendo, Studio Ghibli, instant noodles, and anime."
A185_0,185,Koi fishes
A186_0,186,"AI should be developed with neatness, order, and meticulousness in mind."
A187_0,187,Japan invaded Korea around 100 years ago.
A187_1,187,Japan has impressive architecture.
A188_0,188,Drifting culture and snowboarding the famous Japan powder.
A189_0,189,The comment is inappropriate and does not contribute to the discussion on AI.
A190_0,190,The Olympics in Nagano
A191_0,191,The Japanese language.
A192_0,192,Thrifting!
A193_0,193,AI can optimize train systems for efficiency and safety.
A194_0,194,This input is not relevant to the topic of artificial intelligence.
A195_0,195,AI development should address and mitigate xenophobia.
A196_0,196,This input is not relevant to the topic of artificial intelligence.
A197_0,197,New York but better.
A198_0,198,Shinto shrines should be preserved and respected in the development of AI technologies.
A199_0,199,"AI can help optimize energy grids, reducing waste and carbon emissions."
A201_0,201,AI should support hard-working people by enhancing productivity and reducing repetitive tasks.
A202_0,202,"A culture that promotes overworking and stigmatizes failure is harmful, even if it results in orderly public behavior."
A202_1,202,"Xenophobia in Japan leads to discrimination against long-term residents and non-Japanese individuals, regardless of race."
A203_0,203,This input does not appear to be relevant to the topic of artificial intelligence.
A204_0,204,"AI can help optimize energy grids, reducing waste and carbon emissions."
A205_0,205,"Japan is known for quality shotguns, automobiles, and a rich history."
A205_1,205,Japan excels in customizing Harley Davidson motorcycles.
A205_2,205,"Despite events like Pearl Harbor and WWII, every country has its own demons."
A206_0,206,Nanking
A207_0,207,AI should be regulated to prevent its use in committing war crimes.
A209_0,209,Logan Paul is a public figure often associated with social media and entertainment.
A210_0,210,AI could be used to create images of beautiful women that age very slowly.
A211_0,211,I miss the food and the people.
A211_1,211,I had a great time living there.
A213_0,213,"I once bought my friend a humorous gift for his birthday, and the memory still makes me laugh years later."
A214_0,214,AI should be used to prevent and document war crimes.
A215_0,215,AI could be used to improve the diagnosis and treatment of mental illness.
A216_0,216,Anime can be perceived as bizarre and creepy by some people.
A218_0,218,The Rape of Nanjing was a horrific event during which Japanese forces committed mass atrocities against Chinese civilians and soldiers in Nanjing during the Second Sino-Japanese War.
A220_0,220,This comment is inappropriate and does not contribute to the discussion on AI.
A221_0,221,Anime
A223_0,223,"Adderall is illegal and possession can lead to arrest, even with a prescription."
A223_1,223,The community is unkind to LGBTQ+ individuals.
A223_2,223,"There is significant xenophobia, with reluctance to rent to or hire foreigners."
A223_3,223,Pedophilic manga is still prevalent.
A223_4,223,The drinking culture is problematic.
A223_5,223,The handling of death row is cruel.
A223_6,223,"We get another Ghibli movie with Miyazaki at the helm, but the work culture around its production was probably terrible."
A224_0,224,Empire of the Rising Sun
A225_0,225,Sushi is a popular Japanese cuisine.
A225_1,225,Cherry blossoms are a significant cultural symbol in Japan.
A225_2,225,"Pearl Harbor is a historic site in Hawaii, known for the 1941 attack."
A226_0,226,"AI can enhance energy grid efficiency, reducing waste and carbon emissions."
A227_0,227,I want to move there.
A228_0,228,Some cultural traditions may seem outdated or unnecessary.
A230_0,230,AI policies should consider historical injustices and their long-term impacts on communities.
A231_0,231,JaPOW! It's a top destination for a ski trip.
A232_0,232,STARDOM offers some of the best women's wrestling in the world but is flying under the radar.
A232_1,232,There should be more awareness about the cleanliness and acceptable/cute racism in Japanese women's wrestling.
A233_0,233,"Japan conducted more heinous human experimentation than Nazi Germany, but many people are unaware of this."
A235_0,235,Ohio
A236_0,236,"I miss the beautiful young women and healthy food from my home country, which are hard or expensive to find in Australia."
A237_0,237,"AI can help optimize energy grids, reducing waste and carbon emissions."
A238_0,238,AI can create amazing animations.
A239_0,239,AI development should be guided by strict ethical standards and regulations.
A240_0,240,"AI can help optimize energy grids, reducing waste and carbon emissions."
A241_0,241,This argument is unclear and does not seem relevant to the topic of artificial intelligence.
A242_0,242,Great value for money with high-quality service and no tipping.
A242_1,242,Reasonable prices and low sales tax.
A243_0,243,"Sharp swords, the rising red sun, and E-Honda’s music in Street Fighter 2."
A244_0,244,Here comes the sun.
A245_0,245,AI can lead to the development of cool gadgets and advanced technologies.
A246_0,246,The representation of women in AI development and deployment should be considered to ensure diversity and inclusivity.
A247_0,247,AI should be designed to prevent misuse by individuals with harmful intentions.
A248_0,248,There should be regulations against vending machines that sell used panties to prevent exploitation and maintain public decency.
A250_0,250,AI can advance scientific research and innovation.
A252_0,252,"The use of AI in military applications raises ethical concerns, such as the potential for catastrophic consequences."
A253_0,253,The impact of AI on Japanese society should be considered.
A254_0,254,The argument is unclear and needs more detail.
A255_0,255,Inappropriate content detected. Please provide a relevant argument related to artificial intelligence.
A256_0,256,This input is not relevant to the topic of artificial intelligence.
A257_0,257,"This is a nice place, all things considered."
A258_0,258,Anime often portrays problematic scenarios involving young girls on trains.
A259_0,259,Disparaging comments about specific groups are unproductive and should be avoided.
A260_0,260,Personal experiences with substances can lead to disorienting and humorous situations.
A261_0,261,"I felt disillusioned and betrayed when I learned that the U.S. forced Japanese American citizens into camps during World War II, depriving them of their homes and belongings."
A261_1,261,It is shocking that this happened during the same war in which the U.S. applauds itself for freeing Jews from concentration camps abroad.
A262_0,262,AI should be designed to promote good behavior and ethical practices.
A263_0,263,"Some people are still deeply affected by WWII, similar to Japanese soldiers who remained in the jungle until the 1970s, refusing to surrender."
A264_0,264,"AI can help manage traffic flow to reduce congestion, even during off-peak hours like 3 am."
A265_0,265,This input is not relevant to the topic of artificial intelligence.
A266_0,266,Cultural issues in corporate environments can lead to poor decision-making and crisis management.
A266_1,266,The Fukushima disaster was exacerbated by a cultural tendency to follow orders rather than take initiative.
A267_0,267,Sushi and udon.
A268_0,268,Midnight Diner on Netflix.
A269_0,269,The consultation should focus on relevant and respectful contributions.
A270_0,270,AI should be developed with the needs of future generations in mind.
A271_0,271,Yakushima or people with old coffee beans in storefronts have more marketing nerve than independent coffee places in the U.S.
A272_0,272,"Watching documentaries about AI and its potential misuse can be distressing, similar to those about Nazis."
A273_0,273,No clear argument provided.
A274_0,274,AI can optimize smart homes and buildings for energy efficiency and occupant wellbeing.
A275_0,275,No relevant argument provided.
A278_0,278,Tradition is important.
A278_1,278,Vending machines are useful.
A279_0,279,"AI can help optimize energy grids, reducing waste and carbon emissions."
A280_0,280,Fast and Furious: Tokyo Drift
A281_0,281,"Heated toilet seats and a warm water jet spray for cleaning, followed by warm air drying, offer exceptional comfort."
A282_0,282,Manga and video games are popular aspects of Japanese culture.
A282_1,282,Japanese women are often considered very attractive.
A283_0,283,America spent significant resources reconstructing Japan after Hiroshima and Nagasaki instead of investing in its own infrastructure.
A284_0,284,I have a strong affection for Japan after spending nine months there in 1986.
A285_0,285,AI is an exciting field with great potential for future developments.
A286_0,286,Shinjuku
A288_0,288,AI can improve food production and distribution.
A289_0,289,"In Japan, being an office worker is important for men, and being a housewife is important for women."
A289_1,289,"Despite these traditional roles, Japan can be seen as a good place from a non-emotional perspective."
A290_0,290,AI systems are rapidly advancing and could soon replace ninety percent of human labor.
A290_1,290,This could lead to social unrest as people may not receive financial support.
A290_2,290,Countries with large populations like China and the U.S. could face significant challenges.
A290_3,290,"Countries with lower populations and strong social systems, like Japan, Nordic countries, and New Zealand, may fare better."
A291_0,291,I dislike American breakfasts and prefer living elsewhere.
A293_0,293,The use of AI in military applications raises ethical and safety concerns.
A294_0,294,"People often forget that Nagasaki was also bombed, and it was worse than Hiroshima."
A294_1,294,The Japanese government might have covered up the extent of the Nagasaki bombing.
A295_0,295,China is a key player in the development and deployment of AI technologies.
A297_0,297,AI could contribute to a conformist and tyrannical society.
A298_0,298,This statement is inappropriate and not relevant to the topic of artificial intelligence.
A299_0,299,The development and use of AI in nuclear technology should be carefully regulated.
A300_0,300,This comment is inappropriate and does not contribute to the discussion on AI.
A301_0,301,"There are concerns about racism in AI systems, particularly in comparison to issues in the United States."
A302_0,302,The obsession with Japanese culture can be excessive and unbalanced.
A304_0,304,Honda
A304_1,304,Citizen Eco-Drive
A304_2,304,Sony
A304_3,304,ShoGun
A304_4,304,Katana Blades
A304_5,304,Samurai abilities
A304_6,304,Ronin (Ninja)
A304_7,304,Sushi (Sashimi)
A304_8,304,Akira
A307_0,307,AI can enhance earthquake early warning systems.
A308_0,308,I avoid seafood due to my allergy and anxiety about having an allergic reaction.
A309_0,309,This input does not appear to be a relevant argument about artificial intelligence.
A310_0,310,"AI can help optimize energy grids, reducing waste and carbon emissions."
A311_0,311,I want to move there.
A312_0,312,AI could enable the development of innovative products and services.
A313_0,313,Japan won the World Cup this year.
A313_1,313,Imagine a society where everyone cleans up after themselves.
A314_0,314,AI should be used to create reliable products.
A315_0,315,This input does not appear to be related to the topic of artificial intelligence.
A316_0,316,Banzai.
A317_0,317,"AI can help optimize energy grids, reducing waste and carbon emissions."
A318_0,318,"Society is often locked in tradition, which can hinder the adoption of AI."
A320_0,320,Overpopulated streets
A321_0,321,AI can improve efficiency in various sectors.
A323_0,323,A clean country with people who respect nature is important.
A323_1,323,Cool architecture can enhance the living environment.
A324_0,324,"AI can help optimize energy grids, reducing waste and carbon emissions."
A325_0,325,No relevant argument provided.
A326_0,326,"AI can help optimize energy grids, reducing waste and carbon emissions."
A327_0,327,Advanced AI technologies should be developed with a focus on reducing their own environmental impact over their lifecycle.
A328_0,328,Kawasaki
A329_0,329,"AI can help optimize energy grids, reducing waste and carbon emissions."
A330_0,330,Ramen
A331_0,331,Pagodas and cherry blossoms
