arg-id,comment-id,argument
A729_0,729,The image of Mount Fuji and a Shinkansen train stuck with me since I first read about Japan in an encyclopedia as a kid.
A730_0,730,AI development should be guided by strict discipline and ethical standards.
A732_0,732,AI can help improve cleanliness in various environments.
A733_0,733,Japan is known for its cultural contributions like soy sauce and iconic characters like Mothra.
A734_0,734,Cherry blossoms.
A735_0,735,Living in a new place can be difficult due to severe culture shock.
A736_0,736,"AI should enhance aesthetics, such as warm sunsets and peaceful environments."
A738_0,738,AI can optimize energy grids to reduce waste and carbon emissions.
A740_0,740,AI could contribute to extending human lifespan to 120 years.
A742_0,742,We should address the issue of excessive plastic packaging in snacks.
A742_1,742,We need to acknowledge and discuss the war crimes committed during World War II.
A742_2,742,The cultural concept of 'saving face' should be considered in international relations.
A742_3,742,Anime has a significant cultural impact and should be recognized.
A743_0,743,Kimonos and traditional dances are cultural heritage that should be preserved.
A744_0,744,Traditional architecture
A745_0,745,No valid argument provided.
A746_0,746,We are considering making it our first real family vacation.
A747_0,747,AI could improve the efficiency and convenience of pod hotels.
A747_1,747,AI could help address safety concerns related to suspicious behavior on trains.
A748_0,748,AI can help reduce tedium by automating repetitive tasks.
A749_0,749,I thought America was racist until I read about Japan.
A750_0,750,The rise of AI presents both opportunities and challenges.
A752_0,752,Pixels are the smallest unit of a digital image or display.
A753_0,753,Toyota
A754_0,754,"AI can help optimize energy grids, reducing waste and carbon emissions."
A755_0,755,AI can improve food production and distribution.
A756_0,756,Mountains
A757_0,757,AI technologies should be developed with a focus on reducing their own environmental impact over their lifecycle.
A757_1,757,"There should be a concerted effort to educate the public about the capabilities, limitations, and ethical considerations of AI."
A757_2,757,AI can optimize smart homes and buildings for energy efficiency and occupant wellbeing.
A757_3,757,"AI can help optimize energy grids, reducing waste and carbon emissions."
A759_0,759,"Anime is a popular form of entertainment that combines art, storytelling, and culture."
A760_0,760,This is not relevant to the topic of artificial intelligence.
A761_0,761,The location of AI infrastructure on the planet matters.
A763_0,763,"The ethical implications of AI in sensitive areas, such as mental health, need careful consideration."
A764_0,764,Chinese food
A765_0,765,AI should not lead to situations where people have to work until they die.
A767_0,767,Hello!
A768_0,768,AI could lead to job displacement and lower wages.
A769_0,769,"In Japan, I saw businessmen using pillows shaped like anime girl legs attached to cardboard cutouts, likely as a promotional stunt."
A769_1,769,The promotion exceeded my expectations of seeing unusual things in Akihabara.
A770_0,770,Japan has a long history of dedication to perfection and personal discipline.
A770_1,770,"Western influence has negatively impacted Japan's cultural legacy, reducing it to commercialized and controversial elements."
A771_0,771,Bunny Island!
A772_0,772,Tokyo
A774_0,774,"Anime is a popular form of entertainment that combines art, storytelling, and culture."
A776_0,776,"Hey, Bim!"
A777_0,777,This input does not appear to be relevant to the topic of artificial intelligence.
A779_0,779,Disney parks offer cuter and prettier merchandise.
A780_0,780,"Anime is a popular form of entertainment that combines art, storytelling, and culture."
A781_0,781,"I am at a café near the Daya Cat museum, with a view of Lake Kawaguchi and Mount Fuji in the distance, surrounded by Cherry Blossoms."
A782_0,782,I miss it and want to go back.
A783_0,783,Mount Fuji is not relevant to the topic of artificial intelligence.
A784_0,784,Cherry blossoms are beautiful and symbolize the transient nature of life.
A786_0,786,Two bright flashes of light were observed.
A787_0,787,Feudal Japan and samurai
A788_0,788,"Tokyo is very crowded, and the government is paying people to move."
A789_0,789,Sumo
A790_0,790,This input does not appear to be related to the topic of artificial intelligence.
A791_0,791,AI can be used to enhance the safety and efficiency of nuclear energy.
A792_0,792,AI represents futuristic technology.
A793_0,793,AI can optimize energy grids to reduce waste and carbon emissions.
A795_0,795,AI can impact culture in various ways.
A796_0,796,"AI can help optimize energy grids, reducing waste and carbon emissions."
A797_0,797,No relevant argument provided.
A798_0,798,Ninja
A799_0,799,"I'm trying to learn Japanese, including Hiragana, Katakana, and Kanji."
A800_0,800,It's unfair to reduce Japan's contributions to just anime and weeaboos.
A801_0,801,Roppongi
A802_0,802,AI could help create futuristic cities like those depicted in Blade Runner.
A803_0,803,Disciplined people are essential for the responsible development and use of AI.
A803_1,803,"The impact of AI should be managed to avoid catastrophic outcomes, akin to a 'Godzilla' scenario."
A804_0,804,Vending machines should not sell used underwear due to hygiene and ethical concerns.
A805_0,805,Japanese culture includes anime and sushi.
A806_0,806,Ramen
A807_0,807,Cherry blossoms are beautiful and culturally significant.
A808_0,808,Judo
A809_0,809,"Sushi is a traditional Japanese dish made with vinegared rice and various ingredients such as seafood, vegetables, and sometimes tropical fruits."
A810_0,810,AI development should address and mitigate xenophobia.
A811_0,811,Anime is a style of animation that originated in Japan and has a global fanbase.
A812_0,812,Cherry blossoms are beautiful and symbolize the transient nature of life.
A813_0,813,This input does not appear to be relevant to the topic of artificial intelligence.
A814_0,814,This input does not appear to be related to the topic of artificial intelligence.
A816_0,816,Pearl Harbor
A817_0,817,"AI can help optimize energy grids, reducing waste and carbon emissions."
A817_1,817,AI can optimize smart homes and buildings for energy efficiency and occupant wellbeing.
A817_2,817,We should educate the public about the capabilities of AI.
A817_3,817,We should educate the public about the limitations and ethical considerations of AI.
A817_4,817,We should focus on reducing the environmental impact of AI technologies.
A818_0,818,AI can improve high-tech toilets and hot beverage vending machines.
A819_0,819,"Enjoying ramen outdoors, Gundam, and bullet trains in that order."
A821_0,821,This input is not relevant to the topic of artificial intelligence.
A822_0,822,Sushi
A823_0,823,Sashimi
A824_0,824,Robots
A825_0,825,"Mountains covered in thick, sticky snow."
A826_0,826,"Animes, Samurais, and Sushi!"
A827_0,827,Red dot
A827_1,827,Ancient buildings and paintings
A827_2,827,Geisha outfit
A827_3,827,Food
A827_4,827,Friend's mom teaching me to use chopsticks
A827_5,827,Streets of Tokyo
A828_0,828,Hello Kitty is not relevant to the discussion on artificial intelligence.
A829_0,829,There are concerns about AI being used to promote weird porn and weird foods.
A829_1,829,There are concerns about AI being used for cruelty to animals with said foods.
A829_2,829,"Despite these concerns, the people involved seem nice."
A830_0,830,This input is not relevant to the topic of artificial intelligence.
A832_0,832,Cherry blossoms are changing significantly.
A834_0,834,Cherry blossoms.
A835_0,835,Red Circle.
A836_0,836,Pokémon
A837_0,837,"The country has excellent public transportation, great food, video games, and friendly people."
A837_1,837,There is a culture of overworking employees.
A837_2,837,I would love to visit because my grandpa lived there.
A838_0,838,"AI can help optimize energy grids, reducing waste and carbon emissions."
A840_0,840,AI should be used to identify and mitigate toxic work culture.
A841_0,841,"AI can help optimize energy grids, reducing waste and carbon emissions."
A842_0,842,"Identify the best places to live after the UAE based on factors like quality of life, cost of living, and job opportunities."
A843_0,843,AI can perfectly synthesize culture.
A844_0,844,Polite people
A844_1,844,Cherry blossoms
A845_0,845,Tokyo is a vibrant city with many attractions.
A845_1,845,Sushi is a popular and traditional Japanese dish.
A845_2,845,Cherry blossoms are a beautiful and iconic symbol of Japan.
A846_0,846,"Samurai were Japanese warriors known for their martial skills, honor, and loyalty."
A847_0,847,I think about a rising sun.
A849_0,849,"Ukiyo, the floating world."
A850_0,850,Udon noodles are thick and satisfying.
A852_0,852,"AI technologies can enhance everyday products like motorcycles, vinyl records, and record player cartridges."
A853_0,853,Guitars and whisky
A854_0,854,"Anime, sushi, and bowing are cultural elements associated with Japan."
A855_0,855,No relevant argument provided.
A856_0,856,The Band
A857_0,857,AI could be used to develop futuristic toilets.
A857_1,857,AI could be used to create hilarious game shows.
A858_0,858,The Great Wave off Kanagawa has inspired much of the imagery used to represent Japan.
A858_1,858,The Great Wave off Kanagawa is a remarkable art piece.
A859_0,859,The issue of comfort women and the atrocities they faced during WWII should be acknowledged and addressed.
A861_0,861,Inappropriate or offensive content should be filtered out in public consultations.
A863_0,863,How does the sexual culture in Japan differ from that in Western countries?
A864_0,864,"Sushi restaurants with conveyor belts, often found in Japan, use AI to deliver food efficiently."
A865_0,865,The word 'Japan' is not an argument related to AI.
A866_0,866,AI should be regulated to prevent its use in committing war crimes.
A867_0,867,The cats
A868_0,868,Japanese culture is a walking dichotomy.
A871_0,871,Tokyo is a large city known for its neon lights.
A872_0,872,Sakura trees are not relevant to the topic of artificial intelligence.
A873_0,873,I want to visit again; it's been too long!
A875_0,875,This input does not appear to be a relevant argument about artificial intelligence.
A876_0,876,Pokémon
A877_0,877,The Fast and the Furious: Tokyo Drift is a cinematic masterpiece.
A878_0,878,I want to live on an island.
A879_0,879,Please refrain from using derogatory language.
A880_0,880,AI could negatively impact mental health.
A881_0,881,Consider the cultural context of Asia when developing AI technologies.
A882_0,882,"Samurai were Japanese warriors known for their martial skills, honor, and loyalty."
A885_0,885,"When I think of AI, I immediately think of its impact on food, national identity, and entertainment like anime."
A888_0,888,Japan is the cleanest place I have ever been.
A889_0,889,Tokyo
A890_0,890,The cherry blossom tree.
A891_0,891,"AI can help optimize energy grids, reducing waste and carbon emissions."
A892_0,892,"Katana, Ninjas, Anime"
A893_0,893,"Some of the best friends I ever had lived in Oiso, Japan."
A894_0,894,"AI can help optimize energy grids, reducing waste and carbon emissions."
A895_0,895,The development and use of AI in nuclear technology should be carefully regulated.
A896_0,896,The existence of used panties vending machines raises ethical and legal concerns.
A897_0,897,No argument provided.
A898_0,898,AI can create beautiful art with a blend of precision and creativity.
A898_1,898,AI can explore unique artistic concepts like the 'broken doll' theme.
A899_0,899,I hope to visit Aoshima Island and spend time with the cats.
A900_0,900,AI can contribute to fantastic design concepts in various fields.
A901_0,901,The food industry can benefit from AI by improving supply chain efficiency and reducing waste.
A902_0,902,The term 'Kamikaze' is not relevant to the discussion on artificial intelligence.
A903_0,903,Japan is a respectable country with a rich culture worth experiencing.
A904_0,904,Thousands of Americans were killed at Pearl Harbor.
A905_0,905,"Sushi is a traditional Japanese dish made with vinegared rice and various ingredients, such as seafood and vegetables."
A907_0,907,AI can enhance the efficiency and safety of bullet trains.
A907_1,907,AI can improve the performance and innovation of Sony's products.
A908_0,908,This input does not appear to be related to the topic of artificial intelligence.
A909_0,909,Tokyo at night is a vibrant and bustling cityscape.
A910_0,910,"Shinto, hands down."
A911_0,911,One Piece should be followed by other anime.
A912_0,912,The impact of AI on Japanese society should be considered.
A914_0,914,The country is great but has some issues with xenophobia.
A915_0,915,Sushi
A916_0,916,Sushi
A917_0,917,Tokyo has crowded streets with people wearing masks.
A917_1,917,Anime is advertised everywhere in Tokyo.
A919_0,919,This input does not appear to be a relevant argument about artificial intelligence.
A920_0,920,Ramen
A921_0,921,Weird in a good way.
A922_0,922,Rising sun
A923_0,923,Whiskey
A925_0,925,The country is extremely clean and the people are very nice and respectful.
A928_0,928,Studying Japanese is extremely challenging and often feels overwhelming.
A930_0,930,"AI can help optimize energy grids, reducing waste and carbon emissions."
A931_0,931,The city has cute and respectful people.
A932_0,932,This input is not relevant to the discussion on artificial intelligence.
A935_0,935,"AI development should consider historical parallels to avoid repeating past atrocities, such as those committed by the Nazis during WWII."
A936_0,936,I want to go there.
A937_0,937,AI can enhance the distinctive design of old buildings and cars.
A938_0,938,AI should be designed to prioritize ethical considerations and user safety.
A939_0,939,Rice
A940_0,940,Kiryu Kazuma
A941_0,941,AI can lead to the creation of unique and innovative inventions.
A942_0,942,Hokkaido experiences significant snowfall.
A943_0,943,This input does not appear to be an argument related to artificial intelligence.
A944_0,944,We should focus on reducing the environmental impact of AI technologies.
A944_1,944,We should educate the public about the capabilities of AI.
A944_2,944,We should educate the public about the limitations and ethical considerations of AI.
A944_3,944,AI can optimize smart homes and buildings for energy efficiency and occupant wellbeing.
A944_4,944,AI could optimize energy grids to reduce waste and carbon emissions.
A945_0,945,Sakura trees are beautiful and culturally significant.
A946_0,946,Should we prioritize Tokyo or Okinawa for AI development initiatives?
A949_0,949,Japan should be cautious about the development and deployment of AI technologies.
A950_0,950,Square watermelons.
A952_0,952,The impact of AI on Japanese society should be considered.
A953_0,953,Vending machines should be more widely available.
A954_0,954,"My first girlfriend, Ayaka, was beautiful."
A954_1,954,I felt a slight twinge of jealousy that faded quickly.
A954_2,954,"Japan has a rich culture with samurai, ninjas, anime, sushi, and sake."
A955_0,955,"AI can help optimize energy grids, reducing waste and carbon emissions."
A956_0,956,"Experience cherry blossoms and friendly feral deer by day, and neon lights and sake bars by night."
A957_0,957,AI can enhance the experience of anime and video games.
A958_0,958,Cherry blossoms
A959_0,959,The food is amazing.
A960_0,960,AI should benefit both urban areas like Tokyo Tower and rural farmers equally.
A961_0,961,"AI should consider the cultural impacts of its applications, such as in anime and yakuza culture."
A961_1,961,"AI should be mindful of historical sensitivities, like those related to atomic bombs."
A962_0,962,The development of cyborgs raises important ethical and societal questions.
A964_0,964,"Tokyo Tower is a landmark in Tokyo, Japan."
A965_0,965,The beaches of Okinawa are made of crushed seashells and coral instead of sand.
A967_0,967,My friend Justin and his wife live there happily.
A968_0,968,This input is not relevant to the topic of artificial intelligence.
A970_0,970,The bullet train travels through beautiful scenery.
A971_0,971,This input is not relevant to the topic of artificial intelligence.
A972_0,972,Do not rub chopsticks together as it is considered an insult to the host.
A973_0,973,Ramen
A974_0,974,"The place has fantastic food, lovely people, beautiful design, and is uniquely strange."
A975_0,975,Their city's neon lights.
A976_0,976,Hiroshima is an example of the devastating impact of technology when used irresponsibly.
A977_0,977,Black hair and bowl cuts.
A978_0,978,Gran Turismo has successfully combined Japanese jazz and cars.
A979_0,979,Technology
A980_0,980,AI development should prioritize respect for human rights and dignity.
A981_0,981,AI can improve food production and distribution.
A982_0,982,The beauty of nature.
A983_0,983,"AI can help optimize energy grids, reducing waste and carbon emissions."
A984_0,984,The Skytree with its lights turned on and the sound of cicadas.
A986_0,986,AI can help ensure trains run on time.
A988_0,988,Anime and the beautiful cherry blossoms.
A989_0,989,Umeboshi is not relevant to the topic of artificial intelligence.
A990_0,990,AI can assist stressed office workers by providing support and efficiency tools.
A991_0,991,Sony (but maybe not anymore)
A992_0,992,AI can improve the efficiency and safety of bullet trains.
A994_0,994,I can't find clear information on the wages of tradesmen in Japan.
A997_0,997,Sakura trees are not relevant to the discussion on artificial intelligence.
A998_0,998,This input is not relevant to the topic of artificial intelligence.
A999_0,999,The argument is not relevant to the topic of artificial intelligence.
A1000_0,1000,Fermented beans have a strong taste and smell.
