arg-id,comment-id,argument
A332_0,332,AI can contribute to clean and impressive architecture.
A332_1,332,AI can help preserve and promote strong cultural values.
A333_0,333,This input does not seem relevant to the topic of artificial intelligence.
A334_0,334,Cherry blossom
A334_1,334,Mt. Fuji
A334_2,334,Temples
A334_3,334,Pokémon
A334_4,334,Hello Kitty
A334_5,334,Hot springs
A334_6,334,Sushi
A334_7,334,Ramen
A335_0,335,Sushi is not relevant to the topic of artificial intelligence.
A337_0,337,Red
A337_1,337,White
A337_2,337,Cherry Blossoms
A337_3,337,Kyoto
A337_4,337,Shoji (paper doors)
A338_0,338,Crowded
A339_0,339,Monkeys in steaming pools.
A340_0,340,Sailor Moon
A341_0,341,I wish I had the money or means to move to a place with great food and culture.
A342_0,342,Kei Nishikori
A343_0,343,Cats and modern infrastructure.
A344_0,344,AI should address and mitigate toxic work culture.
A345_0,345,Food
A346_0,346,The impact of AI on the adult entertainment industry should be carefully considered.
A347_0,347,Avoid visiting Tokyo in the summer.
A348_0,348,Lone wolf and cub.
A348_1,348,Many tears were shed.
A351_0,351,AI may be viewed more favorably by Westerners compared to people from Asia.
A353_0,353,Land development can lead to significant environmental impacts.
A354_0,354,Best vacation ever.
A355_0,355,I fell in love with Okonomiyaki in Hiroshima and still think about it to this day.
A357_0,357,This input does not appear to be an argument related to artificial intelligence.
A358_0,358,The big wave print by Hokusai comes to mind.
A359_0,359,Sakura
A360_0,360,Goku is not relevant to the discussion on artificial intelligence.
A361_0,361,Toyota should consider integrating AI to enhance their vehicle technology and manufacturing processes.
A362_0,362,Osamu Dazai is the author of the book 'No Longer Human'.
A362_1,362,'No Longer Human' is a novel by Osamu Dazai.
A363_0,363,"AI can help optimize energy grids, reducing waste and carbon emissions."
A364_0,364,Rarapalooza
A366_0,366,Some people might initially think of inappropriate content like 'hentai' but reconsider their response.
A368_0,368,Japan should consider the implications of AI on its society and economy.
A369_0,369,A micro tea cup poodle cafe in Akihabara.
A370_0,370,AI technologies should be developed with a focus on reducing their own environmental impact over their lifecycle.
A370_1,370,"There should be a concerted effort to educate the public about the capabilities, limitations, and ethical considerations of AI."
A370_2,370,AI can optimize smart homes and buildings for energy efficiency and occupant wellbeing.
A370_3,370,"AI can help optimize energy grids, reducing waste and carbon emissions."
A371_0,371,History shows how nature often highlights the mistakes of humanity.
A372_0,372,"Anime is a popular form of entertainment that combines art, storytelling, and music."
A373_0,373,"Washi, Hello Kitty, and other cute items are popular worldwide."
A374_0,374,Retro games are currently available at very low prices.
A375_0,375,Welcome to the rice fields.
A376_0,376,AIはエネルギーグリッドを最適化し、無駄と炭素排出を削減することができます。
A377_0,377,Cherry blossoms are beautiful and worth experiencing.
A377_1,377,"Based on my YouTube habits, head spa treatments like hour-long scalp massages are very relaxing."
A378_0,378,"Anime is a popular form of entertainment that combines art, storytelling, and culture."
A379_0,379,AI can improve the efficiency and user experience of vending machines.
A380_0,380,Cherry blossom trees.
A381_0,381,This is a must-visit place before I die.
A382_0,382,Tokyo is one of the most interesting places I have visited.
A383_0,383,AI can enhance beauty and personal care through personalized recommendations and virtual try-ons.
A384_0,384,This comment is not relevant to the topic of artificial intelligence.
A385_0,385,AI can improve food production and distribution.
A386_0,386,Mochi and other interesting foods should be explored.
A387_0,387,"AI can help optimize energy grids, reducing waste and carbon emissions."
A388_0,388,Tradition and honor should be considered in the development and deployment of AI.
A389_0,389,Seaweed
A390_0,390,"I dreamt of a technologically advanced place with vivid colors, impressive shopping centers, and short bus routes."
A390_1,390,"The people in my dream seemed fun, and the place reminded me of Japan."
A390_2,390,"It's interesting to dream about Japan as a Brit, especially since I'm not obsessed with Japanese culture."
A391_0,391,I would like to visit someday.
A393_0,393,This input does not appear to be a relevant argument about artificial intelligence.
A394_0,394,Shy and quiet individuals
A397_0,397,AI can optimize energy grids to reduce waste and carbon emissions.
A398_0,398,AI can optimize energy grids to reduce waste and carbon emissions.
A399_0,399,Fat Man and Little Boy were the code names for the atomic bombs dropped on Hiroshima and Nagasaki during World War II.
A401_0,401,Tokyo is eerily clean.
A402_0,402,Big red dot
A403_0,403,"AI can help optimize energy grids, reducing waste and carbon emissions."
A404_0,404,Tokyo at night is a vibrant and bustling cityscape.
A405_0,405,Sphere-shaped food is good.
A406_0,406,Zero coming out of the sun.
A408_0,408,Neon lights.
A409_0,409,I enjoy katsu curry.
A410_0,410,"AI can improve various aspects of life, such as entertainment, food, and housing."
A411_0,411,The term 'drunk cattle' is unclear and needs more context to be a valid argument.
A412_0,412,I had a wonderful trip many years ago and hope to go back someday.
A413_0,413,"Anime is a popular form of entertainment that combines art, storytelling, and culture."
A414_0,414,This input is not relevant to the topic of artificial intelligence.
A416_0,416,Advanced AI systems are fundamentally different from traditional technologies.
A417_0,417,The US missed out on many cool cars.
A418_0,418,Japanese people
A419_0,419,Cherry blossoms
A420_0,420,This argument has been removed.
A423_0,423,AI systems can perpetuate and amplify stereotypes.
A424_0,424,I enjoyed my vacations there and the food.
A425_0,425,This input does not appear to be related to the topic of artificial intelligence.
A426_0,426,No argument provided.
A427_0,427,Japanese cherry blossoms are culturally significant and beautiful.
A428_0,428,Neon is a noble gas used in lighting and high-voltage indicators.
A429_0,429,AI can improve food production and distribution.
A430_0,430,"My first thought was Nagasaki, then Tokyo, then anime, and finally video games."
A432_0,432,AI could enable vending machines for a wide variety of products.
A434_0,434,"Samurai were Japanese warriors known for their martial skills, honor, and loyalty."
A435_0,435,Ethics should be a key consideration in the development and deployment of AI.
A436_0,436,AI can be used to predict and mitigate the impact of earthquakes.
A437_0,437,People were generally nice and polite when I traveled there.
A438_0,438,AI can improve food production and distribution.
A439_0,439,"Samurai were Japanese warriors known for their martial skills, honor, and loyalty."
A440_0,440,The food!
A441_0,441,"The development and deployment of AI should consider ethical implications, similar to how historical events like the creation of atomic bombs ('Little Boy' and 'Fat Man') had profound ethical consequences."
A442_0,442,"AI can help optimize energy grids, reducing waste and carbon emissions."
A443_0,443,Cherry blossoms are beautiful and symbolize the transient nature of life.
A444_0,444,Red Dot.
A445_0,445,It's my favorite country in the world.
A445_1,445,I love the food.
A447_0,447,Shinzo Abe is not directly related to the topic of artificial intelligence.
A448_0,448,Naruto
A450_0,450,The fast-motion clip of people crossing roads at a busy triangular junction is often used in YouTube videos about population or Japan/East Asia.
A451_0,451,AI has significant potential for growth and impact in Japan.
A452_0,452,"The Japanese share common traits with everyone else, but to a greater extent."
A454_0,454,Hello!
A455_0,455,Real-life Mario Kart races can be held through the streets of Shinjuku.
A456_0,456,Hidetaka Miyazaki is highly regarded for his contributions to game design.
A457_0,457,I love the culture and history of the country.
A457_1,457,I've visited the country several times and speak the language.
A458_0,458,"Anime is a popular form of entertainment that combines art, storytelling, and culture."
A459_0,459,Pixels are the smallest unit of a digital image or display.
A460_0,460,AI can improve the efficiency and user experience of vending machines.
A461_0,461,1945
A462_0,462,AI development should prioritize diversity and inclusion.
A463_0,463,Kawaii
A464_0,464,Hiroshima is an example of the devastating impact of technology when used irresponsibly.
A466_0,466,People should be polite.
A467_0,467,AI can optimize smart homes and buildings for energy efficiency and occupant wellbeing.
A468_0,468,Sakura trees enhance the beauty of temples.
A469_0,469,Hiroshima is a city in Japan known for its historical significance.
A470_0,470,This input is not relevant to the topic of artificial intelligence.
A473_0,473,AI should be used to detect and prevent the distribution of pixelated porn.
A475_0,475,AI can optimize energy grids to reduce waste and carbon emissions.
A476_0,476,AI should respect cultural values and norms.
A476_1,476,AI should address concerns related to inappropriate or harmful content.
A478_0,478,I miss it a lot.
A480_0,480,This input does not appear to be an argument related to artificial intelligence.
A481_0,481,"AI can help optimize energy grids, reducing waste and carbon emissions."
A482_0,482,I imagine cherry blossoms and a festival when I think about AI.
A483_0,483,"Japan feels like home to me because my wife is Japanese, I lived there for 7 years, and one of our children was born there."
A483_1,483,Japan feels like home but not home anymore.
A484_0,484,"AI can help optimize energy grids, reducing waste and carbon emissions."
A485_0,485,"As a fat man, I can't go out with my young son without making people worried."
A486_0,486,Sushi.
A487_0,487,The term 'Kamikaze' is not relevant to the discussion on artificial intelligence.
A488_0,488,"A mix between Fushimi Inari in Kyoto and Maizen, a restaurant in Tokyo."
A490_0,490,AI can improve the functionality and efficiency of vending machines.
A491_0,491,"Gentlemen Take Polaroids was the best album by the band, with Quiet Life as a close second."
A492_0,492,Cherry Blossoms 🌸
A494_0,494,AI can improve the functionality and efficiency of vending machines.
A495_0,495,Please provide a clear and concise argument related to AI for further assistance.
A496_0,496,"Manga and anime can be influenced by AI in various ways, such as content creation and recommendation systems."
A497_0,497,This input does not appear to be related to the topic of artificial intelligence.
A498_0,498,I want to visit Tokyo DisneySea.
A498_1,498,I want to see Kyoto in person.
A499_0,499,No argument provided.
A500_0,500,I need to visit one of these days.
A501_0,501,Sushi
A502_0,502,Everything in the universe is incredibly small when compared to the vastness of space.
A503_0,503,"There should be regulations on the portrayal of minors in media, including anime and related content."
A505_0,505,Anime and robots
A506_0,506,Toyota and Honda should be considered in discussions about AI in the automotive industry.
A507_0,507,Delicious food
A508_0,508,Japan should invest in AI technologies to stay competitive.
A509_0,509,AI can improve food production and distribution systems.
A510_0,510,GOJIRA!
A512_0,512,Hard Gay is a funny comedian.
A513_0,513,Making sushi with my family and girlfriend was a joyful and memorable experience.
A514_0,514,"The use of AI in weaponry, such as bombs, raises significant ethical concerns."
A516_0,516,The shape of the country and cloudy skies.
A517_0,517,The Nanjing massacre is a significant historical event that should be remembered.
A517_1,517,"Recency bias can influence our focus on historical events, such as the Nanjing massacre, due to recent conversations or media."
A518_0,518,AI should not contribute to horrible working conditions.
A519_0,519,Overly polite people
A519_1,519,Anime
A519_2,519,Rice
A519_3,519,Declining birth rates
A520_0,520,I want to return to the previous state or situation.
A521_0,521,Nanking
A522_0,522,The impact of AI on Japanese society should be considered.
A524_0,524,No relevant argument provided.
A526_0,526,This input is not relevant to the topic of artificial intelligence.
A527_0,527,This input does not contain an argument related to artificial intelligence.
A528_0,528,Idealized cherry trees in bloom in front of Mt. Fuji.
A530_0,530,Deep snow
A532_0,532,AI can optimize energy grids to reduce waste and carbon emissions.
A533_0,533,The development and use of atomic bombs raise significant ethical and safety concerns.
A534_0,534,AI should be designed to prevent and mitigate xenophobia.
A535_0,535,There are concerns about technologically advanced sexual deviants.
A536_0,536,Naruto is not relevant to the topic of artificial intelligence.
A537_0,537,Tokyo is a massive city.
A538_0,538,Kawaii girls and neon signs/TV billboards at night.
A539_0,539,"AI can improve the safety of public transportation, such as buses."
A540_0,540,This input does not appear to be related to the topic of artificial intelligence.
A541_0,541,"AI should not be used for autonomous weapons, such as dropping bombs from the sky."
A542_0,542,"AI can help optimize energy grids, reducing waste and carbon emissions."
A543_0,543,AI can impact culture in various ways.
A544_0,544,AI can improve food production and distribution systems.
A545_0,545,AI should be developed with a focus on reducing its environmental impact over its lifecycle.
A545_1,545,"We should educate the public about the capabilities, limitations, and ethical considerations of AI."
A545_2,545,AI can optimize smart homes and buildings for energy efficiency and occupant wellbeing.
A545_3,545,AI could optimize energy grids to reduce waste and carbon emissions.
A547_0,547,Ramen
A548_0,548,Seafood
A549_0,549,Affordable small apartments are important.
A549_1,549,A large expat community teaching English is beneficial.
A550_0,550,Purple lights
A551_0,551,"Geishas, cherry blossoms, and bullet trains are iconic symbols of Japanese culture."
A552_0,552,AI could optimize energy grids to reduce waste and carbon emissions.
A552_1,552,I've heard that the world's most unhappy people live in beautiful places.
A553_0,553,Ramen
A554_0,554,Even the smallest ramen shop can offer the best food.
A554_1,554,Always look for unique dining experiences.
A556_0,556,"AI can optimize energy grids, reducing waste and carbon emissions."
A557_0,557,AI can improve food production and distribution.
A558_0,558,The argument 'Pink trees' is unclear and lacks context. Please provide more details or clarify the statement.
A559_0,559,Hibachi
A560_0,560,AI can be used to improve the safety and performance of drifting cars.
A561_0,561,"Young people are too stressed to build families, leading to areas with aging populations."
A563_0,563,AI can improve the management of waterfronts and fish markets.
A565_0,565,Cherry blossoms are beautiful and culturally significant.
A567_0,567,AI can improve food production and distribution.
A568_0,568,NJPW (New Japan Pro-Wrestling) is a professional wrestling promotion based in Japan.
A571_0,571,You are already dead.
A572_0,572,Japan's industry involves killing endangered whales and other highly intelligent cetaceans.
A573_0,573,Izuku Midoriya is a fictional character from the anime and manga series 'My Hero Academia.'
A574_0,574,No argument provided.
A575_0,575,This country is one of the safest in the world.
A575_1,575,This country has amazing food.
A576_0,576,Tokyo is a major city known for its advanced technology and culture.
A576_1,576,Godzilla is a popular cultural icon originating from Japan.
A576_2,576,Sushi is a traditional Japanese dish enjoyed worldwide.
A577_0,577,The bombings of Hiroshima and Nagasaki were dark times in world history.
A580_0,580,AI development should be guided by strict ethical standards and regulations.
A581_0,581,Japanese gardens and cozy houses reflect a blend of modernity and tradition.
A581_1,581,Anime is a significant cultural element in Japan.
A581_2,581,The Hokkaido level in the Hitman video game captures this blend of modernity and tradition.
A582_0,582,This input is unclear and needs more context to be turned into a concise argument.
A583_0,583,Sushi
A585_0,585,Drift cars
A586_0,586,Good food is essential for health and well-being.
A587_0,587,AI can help manage and improve the efficiency of crowded cities.
A589_0,589,No clear argument provided.
A590_0,590,There is a significant amount of snow up north.
A591_0,591,Seafood
A592_0,592,I have been advised not to continue further.
A593_0,593,My people were subjected to imperialism.
A594_0,594,Gaussian blur is a technique used in image processing to reduce noise and detail.
A595_0,595,Trains were crowded all day long.
A596_0,596,"Sushi is a traditional Japanese dish made with vinegared rice and various ingredients such as seafood, vegetables, and sometimes tropical fruits."
A597_0,597,Cars are becoming over-engineered.
A598_0,598,Technology
A600_0,600,Robotech
A601_0,601,Sushi
A602_0,602,A clip shows a guy on a tour that suddenly becomes chaotic.
A603_0,603,Pagodas and Torii gates are significant cultural symbols.
A604_0,604,This input does not seem relevant to the topic of artificial intelligence.
A605_0,605,No argument provided.
A607_0,607,This input does not appear to be a relevant argument about artificial intelligence.
A609_0,609,"Paullie Walnuts in The Sopranos mistakenly referred to a Korean man while saying, 'Word to the wise kid, never forget Pearl Harbor.'"
A611_0,611,"Videos of people walking around Japanese cities at night, especially in the rain with neon signs, create a nice and enjoyable sensation."
A612_0,612,Respect
A613_0,613,Geisha
A615_0,615,Cherry blossom trees are beautiful and culturally significant.
A616_0,616,The best country I ever traveled to.
A617_0,617,Tradition is important.
A617_1,617,Respect for authority is important.
A617_2,617,3rd generation artisans should be valued.
A617_3,617,Ninjas are significant.
A618_0,618,Many beliefs about food are based on urban legends.
A619_0,619,AI should be used to address and mitigate negative cultural and societal issues.
A619_1,619,AI can help promote and preserve positive cultural aspects and achievements.
A621_0,621,"Some places are technologically advanced, living as if they are 200 years in the future."
A622_0,622,Red dot
A624_0,624,"AI can help optimize energy grids, reducing waste and carbon emissions."
A625_0,625,"I want to go, but I don't speak the language very well."
A626_0,626,Sushi is not relevant to the topic of artificial intelligence.
A627_0,627,NJPW (New Japan Pro-Wrestling) is a professional wrestling promotion based in Japan.
A628_0,628,"The development and use of AI in warfare could have devastating consequences, similar to the impact of nuclear weapons in World War II."
A629_0,629,Cherry Blossom Trees
A630_0,630,Clothing sizes vary significantly between the U.S. and boutiques in Harajuku.
A631_0,631,The relentless pursuit of productivity can lead to burnout and a lack of work-life balance.
A632_0,632,Mount Fuji is not relevant to the topic of artificial intelligence.
A633_0,633,Arcade rhythm games provide an engaging and interactive way to enjoy music.
A634_0,634,No clear argument provided.
A635_0,635,"Karate, originating from Okinawa, is a significant cultural contribution."
A635_1,635,Anime is a popular and influential form of entertainment.
A635_2,635,Japanese cuisine is renowned for its unique flavors and presentation.
A635_3,635,The samurai are an iconic symbol of Japanese history and culture.
A636_0,636,This input does not appear to be related to the topic of artificial intelligence.
A637_0,637,"AI can influence extreme work ethics, leading to both positive and negative outcomes."
A638_0,638,Some places are quiet and antisocial.
A639_0,639,Vacation.
A640_0,640,"Living there for six years, I found the Kafkaesque paperwork at the ward office burdensome."
A641_0,641,AI can help create innovative and efficient building designs.
A642_0,642,Cherry blossoms
A643_0,643,I work for a company headquartered in Japan but located in the United States.
A644_0,644,Tokyo and Mt. Fuji are significant landmarks in Japan.
A645_0,645,AI can assist elderly people in their daily lives.
A646_0,646,"Kyoto is a city where I would love to live, even though I am not typically a city person."
A648_0,648,I really want to go!
A649_0,649,Mount Fuji and cherry blossoms are iconic symbols of Japan.
A650_0,650,The snow is so deep that it feels like I need a snorkel.
A651_0,651,No relevant argument provided.
A652_0,652,I want to visit Japan.
A653_0,653,Sushi
A654_0,654,Sushi
A655_0,655,This input does not seem relevant to the topic of artificial intelligence.
A656_0,656,Sushi
A657_0,657,AI has the potential to revolutionize various industries and aspects of life.
A658_0,658,Cherry blossom trees enhance natural beauty.
A658_1,658,Sand gardens provide a serene and meditative environment.
A659_0,659,Tokyo
A659_1,659,Sushi
A659_2,659,Anime
A659_3,659,Kyoto
A660_0,660,Thank you very much.
A661_0,661,The Suicide Cliffs of Saipan are a historical site where many civilians and soldiers tragically lost their lives during World War II.
A662_0,662,This statement is not relevant to the topic of artificial intelligence.
A663_0,663,Dirty underwear should not be available for purchase in vending machines.
A664_0,664,A woman at a metro station in Tokyo helped me find the right line and was very helpful.
A665_0,665,Wabi-sabi is a Japanese aesthetic that finds beauty in imperfection and impermanence.
A666_0,666,Shinto and Zen Buddhism are important cultural aspects.
A666_1,666,Temple bells are significant in Shinto and Zen Buddhism.
A667_0,667,Crowded spaces with no free space to move.
A667_1,667,Used panties in vending machines but no real porn.
A668_0,668,Final Fantasy games should be considered in discussions about AI in gaming.
A670_0,670,This input is not relevant to the topic of artificial intelligence.
A671_0,671,Tokyo
A672_0,672,Sushi & Anime
A673_0,673,The argument is unclear and lacks context.
A674_0,674,Good food
A675_0,675,AI should be used to monitor and prevent war crimes.
A676_0,676,AI can enhance the development and personalization of J-beauty skincare products.
A677_0,677,Sushi in Japan is incredible.
A678_0,678,Some people idealize skiing in an unusual way.
A679_0,679,Their buildings and the rhinoceros beetles.
A680_0,680,Japan is a fascinating country.
A681_0,681,They were allied with Germany in WWII.
A682_0,682,AI can improve food production and distribution.
A683_0,683,The Japanese Central Bank owns a significant portion of Japan's equity market.
A684_0,684,This input is not relevant to the topic of artificial intelligence.
A685_0,685,"Karaoke is very popular in Okinawa, as I observed during my deployment there."
A686_0,686,One of my favorite 80's bands.
A687_0,687,Japan should be a key player in the development and regulation of AI technologies.
A688_0,688,Their society has a very low crime rate and people are super polite.
A688_1,688,"However, the work culture is horrible, and excessive respect for superiors can halt progress due to stubborn old bosses."
A689_0,689,Ishidaya steakhouse in Kobe served the best meal I've ever eaten. I still think about it years later.
A690_0,690,"The general physical fitness level of the population is high, with no cases of obesity."
A691_0,691,"Building a nuclear reactor on a subduction zone, like Fukushima, was a predictable risk."
A692_0,692,"Gourmet ramen is warm and inviting, unlike instant ramen."
A693_0,693,The beautiful architecture
A694_0,694,Nanking
A696_0,696,Tokyo's streets are often very crowded.
A698_0,698,"Samurai were Japanese warriors known for their martial skills, honor, and loyalty."
A699_0,699,I want to visit just for the vending machines.
A700_0,700,"AI culture is fascinating, with both great and awful aspects, and is very different from Western culture."
A703_0,703,Pride never dies.
A704_0,704,AI can optimize energy grids to reduce waste and carbon emissions.
A705_0,705,This input does not appear to be an argument related to artificial intelligence.
A706_0,706,"A classic Japanese house with paper walls and a big pink cherry blossom tree in front, set on a hill with spectacular mountains in the background."
A707_0,707,I have an abiding passion for sushi.
A708_0,708,"Family, bike lanes, and noodles."
A709_0,709,Red circle
A710_0,710,AI can improve food production and distribution.
A711_0,711,AI can optimize the design and manufacturing of electronics.
A712_0,712,This input does not seem to be related to the topic of artificial intelligence.
A713_0,713,The thought of committing sudoku.
A714_0,714,"AI can enhance advanced technologies like holograms, 3D billboards, and robots."
A715_0,715,WW2 war crimes included the massacre of Koreans and Chinese.
A716_0,716,People who watch anime often wish to experience the anime world.
A718_0,718,Busy cities with polite people going about their business.
A720_0,720,Cherry blossom
A721_0,721,"Japan is known for its rich culture, delicious food, and natural beauty."
A722_0,722,The country is beautiful but has issues with xenophobia.
A723_0,723,Cherry blossom trees enhance the beauty of temples.
A724_0,724,AI should be regulated to prevent its use in committing war crimes.
A725_0,725,Irasshimase
A726_0,726,AI should be used to prevent the proliferation and use of nuclear weapons.
A727_0,727,Ramen
A728_0,728,The term 'Godzuki' is unclear in this context and needs further clarification.
